{
  "artifacts": [
    {
      "path": "artifacts/autosci/runs/shim-exp-run-remote-helper/novelty_final_acceptance_boundary.json",
      "type": "novelty_final_acceptance_boundary_json"
    },
    {
      "path": "artifacts/autosci/runs/shim-exp-run-remote-helper/wiki_state_resolver.json",
      "type": "wiki_state_resolver_json"
    },
    {
      "path": "artifacts/autosci/runs/shim-exp-run-remote-helper/idea_evaluation.json",
      "type": "solar_evidence_json"
    }
  ],
  "inputs": {
    "after_artifacts": [
      "/Users/jamesyuan/Developer/Github Repos (On Git)/BetterSolar/docs/testing/test-runs/20260710-0121-qa-full-audit/tmp/codex-not-run-autosci-shim-rerun-final/codex-nr-0009/pytest/test_autosci_skill_shim_exp_ru4/exp-remote-after.json"
    ],
    "allowlist_evidence": [
      "/Users/jamesyuan/Developer/Github Repos (On Git)/BetterSolar/docs/testing/test-runs/20260710-0121-qa-full-audit/tmp/codex-not-run-autosci-shim-rerun-final/codex-nr-0009/pytest/test_autosci_skill_shim_exp_ru4/exp-remote-allowlist.json"
    ],
    "approval_ref": "approval-exp-remote",
    "before_artifacts": [
      "/Users/jamesyuan/Developer/Github Repos (On Git)/BetterSolar/docs/testing/test-runs/20260710-0121-qa-full-audit/tmp/codex-not-run-autosci-shim-rerun-final/codex-nr-0009/pytest/test_autosci_skill_shim_exp_ru4/exp-remote-before.json"
    ],
    "claims_evidence": "artifacts/autosci/runs/shim-exp-run-remote-helper/research_claims.json",
    "execute_approved_side_effect": true,
    "ideas_evidence": "artifacts/autosci/runs/shim-exp-run-remote-helper/idea_candidate.json",
    "memory_evidence": "artifacts/autosci/runs/shim-exp-run-remote-helper/research_memory_update.json",
    "method_evidence": "artifacts/autosci/runs/shim-exp-run-remote-helper/research_method.json",
    "native_options": {
      "add": "",
      "affiliation_logo": "",
      "after_artifacts": [
        "/Users/jamesyuan/Developer/Github Repos (On Git)/BetterSolar/docs/testing/test-runs/20260710-0121-qa-full-audit/tmp/codex-not-run-autosci-shim-rerun-final/codex-nr-0009/pytest/test_autosci_skill_shim_exp_ru4/exp-remote-after.json"
      ],
      "all": false,
      "allowlist_evidence": [
        "/Users/jamesyuan/Developer/Github Repos (On Git)/BetterSolar/docs/testing/test-runs/20260710-0121-qa-full-audit/tmp/codex-not-run-autosci-shim-rerun-final/codex-nr-0009/pytest/test_autosci_skill_shim_exp_ru4/exp-remote-allowlist.json"
      ],
      "anonymous": false,
      "approval_ref": "approval-exp-remote",
      "authors": "",
      "auto": false,
      "auto_figures": false,
      "before_artifacts": [
        "/Users/jamesyuan/Developer/Github Repos (On Git)/BetterSolar/docs/testing/test-runs/20260710-0121-qa-full-audit/tmp/codex-not-run-autosci-shim-rerun-final/codex-nr-0009/pytest/test_autosci_skill_shim_exp_ru4/exp-remote-before.json"
      ],
      "canvas": false,
      "checklist": false,
      "claims_evidence": [],
      "code_evidence": [],
      "collect": false,
      "collect_ready": false,
      "compile_after_artifacts": [],
      "compile_allowlist_evidence": [],
      "compile_approval_ref": "",
      "compile_before_artifacts": [],
      "compile_execute_approved": false,
      "compile_executor_timeout_seconds": 120,
      "compile_runtime_evidence": [],
      "compile_target": "",
      "conference_logo": "",
      "crystallize": false,
      "daily_categories": [],
      "daily_decisions": "",
      "daily_feed": "",
      "daily_hours": 0,
      "daily_max_auto_ingest": 0,
      "daily_max_recommendations": 0,
      "daily_mode": "",
      "daily_no_external": false,
      "daily_send_email": "",
      "depth": 0,
      "difficulty": "",
      "discover": false,
      "double_blind": false,
      "edge_types": "",
      "env": "local",
      "execute_approved": true,
      "experiment_after_artifacts": [],
      "experiment_allowlist_evidence": [],
      "experiment_approval_ref": "",
      "experiment_before_artifacts": [],
      "experiment_execute_approved": false,
      "experiment_executor_timeout_seconds": 120,
      "experiment_result_evidence": [],
      "experiment_runtime_evidence": [],
      "fix": false,
      "focus": "",
      "format": "",
      "full": false,
      "idea_approval_ref": "",
      "layout": "",
      "lifecycle_summary": [],
      "max_ideas": 0,
      "max_rounds": 0,
      "min_font_size": null,
      "model_command": "",
      "model_evidence": [],
      "no_figures": false,
      "no_introduction": false,
      "no_logos": false,
      "no_refine": false,
      "novelty_evidence": [],
      "obsidian": false,
      "online": false,
      "page_count": null,
      "page_limit": null,
      "paper_slug": "",
      "pdf_inspection": "",
      "pilot_handoff_evidence": [],
      "pilot_runtime_evidence": [],
      "pipeline": "",
      "quick": false,
      "refine_iterations": 0,
      "remote_check_command": "",
      "remote_run_dir": "",
      "render": false,
      "require_review_llm": false,
      "results_approval_ref": "",
      "review": true,
      "review_llm_command": "",
      "review_llm_endpoint": "",
      "review_llm_evidence": [],
      "review_llm_model": "",
      "review_llm_provider": "",
      "reviewer_thread_evidence": [],
      "runtime_evidence": [],
      "scheduler_demo": false,
      "scheduler_dispatch_external_evidence": false,
      "scheduler_include_blocked_external": false,
      "scheduler_include_human_gates": false,
      "scheduler_legacy_smoke_runner": false,
      "scheduler_node_id": [],
      "scheduler_require_workflow_config_alignment": false,
      "scheduler_run": false,
      "scheduler_timeout": 30.0,
      "scope": "",
      "serve": false,
      "skip_paper": false,
      "skip_pilot": false,
      "skip_validation": false,
      "source_evidence": [],
      "start_from": "",
      "stress_test": null,
      "submission_audit": "",
      "submission_mode": "",
      "submission_profile": "",
      "target_score": 0.0,
      "title": "",
      "types": "",
      "verbose": false,
      "verified_min_font_size": null,
      "verified_page_count": null,
      "visualize": false,
      "write": false
    },
    "online_novelty": true,
    "review_llm_requested": true,
    "smoke_mode": false,
    "topic": "exp-remote"
  },
  "limitations": [
    "Novelty/review signals are derived from local wiki/discovery evidence.",
    "Independent Review LLM and live external search are still required before promotion.",
    "Novelty final acceptance boundary is incomplete for at least one evaluated idea.",
    "Target `exp-remote` was not found in wiki ideas, experiments, outputs, or graph edges.",
    "Resolver is read-only; it does not mutate wiki state, add graph edges, or rebuild wiki indexes.",
    "Frontmatter parsing supports scalar values and simple lists only; complex YAML is reported through missing fields.",
    "No wiki root exists for state resolution."
  ],
  "node_id": "node-evaluate-ideas",
  "outputs": {
    "evaluations": [
      {
        "duplicate_status": "insufficient_source",
        "evidence_ids": [
          "idea-source-missing",
          "missing:wiki-or-discovery-evidence"
        ],
        "feasibility": 0.2,
        "feasibility_rationale": "Feasibility cannot be assessed without a concrete sourced idea.",
        "final_acceptance_boundary": {
          "blocking_reasons": [
            "external_novelty status is `missing`, not `completed`",
            "external_novelty provenance status is `missing`, not `passed`",
            "review_llm status is `missing`, not `completed`"
          ],
          "evidence_ids": [
            "idea-source-missing",
            "missing:wiki-or-discovery-evidence"
          ],
          "external_novelty_provenance_status": "missing",
          "external_novelty_status": "missing",
          "external_source_count": "N/A",
          "final_acceptance_ready": false,
          "idea_id": "idea-source-missing",
          "limitations": [
            "Novelty final acceptance requires completed external novelty evidence, passed provider provenance, and completed Review LLM evidence."
          ],
          "novelty": 0.0,
          "novelty_score": 1,
          "provider_statuses": [],
          "recommendation": "inconclusive",
          "review_available": false,
          "review_invocation_mode": "N/A",
          "review_llm_status": "missing",
          "review_mode": "N/A",
          "schema": "autosci_novelty_final_acceptance_boundary.v1",
          "status": "novelty_acceptance_incomplete"
        },
        "idea_id": "idea-source-missing",
        "novelty": 0.0,
        "novelty_rationale": "Novelty cannot be assessed without source evidence.",
        "recommendation": "inconclusive",
        "risks": [
          "No wiki, discovery, or paper source evidence was available."
        ],
        "source_mode": "missing"
      }
    ]
  },
  "provenance": {
    "implementation_package": "plugins/autosci",
    "operator_id": "autosci-bridge",
    "timestamp": "2026-07-10T19:25:45Z"
  },
  "schema": "idea_evaluation.v1",
  "sprint_id": "phase19-skillgen-operator-smoke",
  "status": "completed",
  "task_id": "task-autosci-skillgen-evaluate_ideas"
}
